{
  "schemaVersion": 1,
  "sources": [
    {
      "slug": "lanz-precht",
      "catalogVersion": 1,
      "locale": "de",
      "title": "Lanz und Precht - der Podcast",
      "summary": "Diskussionen zu Philosophie, Gesellschaft und Politik.",
      "type": "youtube_videos",
      "value": "https://www.youtube.com/playlist?list=PLdPrKDvwrog6nXguUXjQcTIw685Xa6Bg5",
      "sourceTypes": [
        "youtube_videos"
      ],
      "topics": [
        "philosophy",
        "society",
        "politics"
      ],
      "editorialRank": 1,
      "metadata": {
        "title": "Lanz und Precht - der Podcast",
        "coverImageUrl": null,
        "itemCount": 0,
        "audioCount": 0,
        "previewItems": []
      }
    },
    {
      "slug": "deffner-zschaepitz",
      "catalogVersion": 1,
      "locale": "de",
      "title": "Deffner & Zschaepitz - Der Wirtschafts-Talk",
      "summary": "Wirtschafts- und Boersenanalysen mit Investmentbezug.",
      "type": "youtube_videos",
      "value": "https://www.youtube.com/playlist?list=PL6P5rY8mrhqpepGKeJioq7fKroUvE3dgF",
      "sourceTypes": [
        "youtube_videos"
      ],
      "topics": [
        "economy",
        "markets",
        "investment"
      ],
      "editorialRank": 2,
      "metadata": {
        "title": "Deffner & Zschaepitz - Der Wirtschafts-Talk",
        "coverImageUrl": null,
        "itemCount": 0,
        "audioCount": 0,
        "previewItems": []
      }
    },
    {
      "slug": "alles-auf-aktien",
      "catalogVersion": 1,
      "locale": "de",
      "title": "Alles auf Aktien - Der taegliche Boersen-Shot",
      "summary": "Taegliche Marktimpulse zu Aktien und Boerse.",
      "type": "youtube_videos",
      "value": "https://www.youtube.com/playlist?list=PL6P5rY8mrhqrhVgc_pkSOlRLpuGW3CpJ3",
      "sourceTypes": [
        "youtube_videos"
      ],
      "topics": [
        "stocks",
        "investment",
        "markets"
      ],
      "editorialRank": 3,
      "metadata": {
        "title": "Alles auf Aktien - Der taegliche Boersen-Shot",
        "coverImageUrl": null,
        "itemCount": 0,
        "audioCount": 0,
        "previewItems": []
      }
    },
    {
      "slug": "finanzfluss",
      "catalogVersion": 1,
      "locale": "de",
      "title": "Finanzfluss",
      "summary": "Alltagsfinanzen, ETF-Strategien und langfristiger Vermoegensaufbau.",
      "type": "youtube_videos",
      "value": "https://www.youtube.com/@finanzfluss",
      "sourceTypes": [
        "youtube_videos"
      ],
      "topics": [
        "personal-finance",
        "etf",
        "investment"
      ],
      "editorialRank": 4,
      "metadata": {
        "title": "Finanzfluss",
        "coverImageUrl": null,
        "itemCount": 0,
        "audioCount": 0,
        "previewItems": []
      }
    },
    {
      "slug": "kurzgesagt",
      "catalogVersion": 1,
      "locale": "en",
      "title": "Kurzgesagt",
      "summary": "Science and systems thinking explained with strong visual storytelling.",
      "type": "youtube_videos",
      "value": "https://www.youtube.com/@kurzgesagt",
      "sourceTypes": [
        "youtube_videos"
      ],
      "topics": [
        "science",
        "education",
        "systems-thinking"
      ],
      "editorialRank": 5,
      "metadata": {
        "title": "Kurzgesagt",
        "coverImageUrl": null,
        "itemCount": 0,
        "audioCount": 0,
        "previewItems": []
      }
    },
    {
      "slug": "mailab",
      "catalogVersion": 1,
      "locale": "de",
      "title": "maiLab",
      "summary": "Wissenschaft, Gesundheit und evidenzbasierte Einordnung.",
      "type": "youtube_videos",
      "value": "https://www.youtube.com/@maiLab",
      "sourceTypes": [
        "youtube_videos"
      ],
      "topics": [
        "science",
        "health",
        "evidence"
      ],
      "editorialRank": 6,
      "metadata": {
        "title": "maiLab",
        "coverImageUrl": null,
        "itemCount": 0,
        "audioCount": 0,
        "previewItems": []
      }
    },
    {
      "slug": "simplicissimus",
      "catalogVersion": 1,
      "locale": "de",
      "title": "Simplicissimus",
      "summary": "Gesellschafts- und Medienthemen mit investigativem Fokus.",
      "type": "youtube_videos",
      "value": "https://www.youtube.com/@Simplicissimus2",
      "sourceTypes": [
        "youtube_videos"
      ],
      "topics": [
        "society",
        "media-literacy",
        "current-affairs"
      ],
      "editorialRank": 7,
      "metadata": {
        "title": "Simplicissimus",
        "coverImageUrl": null,
        "itemCount": 0,
        "audioCount": 0,
        "previewItems": []
      }
    },
    {
      "slug": "mrwissen2go",
      "catalogVersion": 1,
      "locale": "de",
      "title": "MrWissen2go",
      "summary": "Politik, Geschichte und gesellschaftliche Einordnung.",
      "type": "youtube_videos",
      "value": "https://www.youtube.com/@MrWissen2go",
      "sourceTypes": [
        "youtube_videos"
      ],
      "topics": [
        "politics",
        "history",
        "society"
      ],
      "editorialRank": 8,
      "metadata": {
        "title": "MrWissen2go",
        "coverImageUrl": null,
        "itemCount": 0,
        "audioCount": 0,
        "previewItems": []
      }
    },
    {
      "slug": "ali-abdaal",
      "catalogVersion": 1,
      "locale": "en",
      "title": "Ali Abdaal",
      "summary": "Productivity systems, career strategy and creator workflows.",
      "type": "youtube_videos",
      "value": "https://www.youtube.com/@aliabdaal",
      "sourceTypes": [
        "youtube_videos"
      ],
      "topics": [
        "productivity",
        "career",
        "learning"
      ],
      "editorialRank": 9,
      "metadata": {
        "title": "Ali Abdaal",
        "coverImageUrl": null,
        "itemCount": 0,
        "audioCount": 0,
        "previewItems": []
      }
    },
    {
      "slug": "thomas-frank",
      "catalogVersion": 1,
      "locale": "en",
      "title": "Thomas Frank",
      "summary": "Study strategy, note systems and student productivity.",
      "type": "youtube_videos",
      "value": "https://www.youtube.com/@Thomasfrank",
      "sourceTypes": [
        "youtube_videos"
      ],
      "topics": [
        "students",
        "study",
        "productivity"
      ],
      "editorialRank": 10,
      "metadata": {
        "title": "Thomas Frank",
        "coverImageUrl": null,
        "itemCount": 0,
        "audioCount": 0,
        "previewItems": []
      }
    },
    {
      "slug": "3blue1brown",
      "catalogVersion": 1,
      "locale": "en",
      "title": "3Blue1Brown",
      "summary": "Math intuition and statistical reasoning via visual explanations.",
      "type": "youtube_videos",
      "value": "https://www.youtube.com/@3blue1brown",
      "sourceTypes": [
        "youtube_videos"
      ],
      "topics": [
        "math",
        "statistics",
        "education"
      ],
      "editorialRank": 11,
      "metadata": {
        "title": "3Blue1Brown",
        "coverImageUrl": null,
        "itemCount": 0,
        "audioCount": 0,
        "previewItems": []
      }
    },
    {
      "slug": "huberman-lab",
      "catalogVersion": 1,
      "locale": "en",
      "title": "Huberman Lab",
      "summary": "Neuroscience-backed protocols for sleep, focus and health habits.",
      "type": "youtube_videos",
      "value": "https://www.youtube.com/@hubermanlab",
      "sourceTypes": [
        "youtube_videos"
      ],
      "topics": [
        "health",
        "psychology",
        "sleep"
      ],
      "editorialRank": 12,
      "metadata": {
        "title": "Huberman Lab",
        "coverImageUrl": null,
        "itemCount": 0,
        "audioCount": 0,
        "previewItems": []
      }
    },
    {
      "slug": "dr-julie",
      "catalogVersion": 1,
      "locale": "en",
      "title": "Dr. Julie",
      "summary": "Practical psychology for anxiety, stress and emotional resilience.",
      "type": "youtube_videos",
      "value": "https://www.youtube.com/@drjulie",
      "sourceTypes": [
        "youtube_videos"
      ],
      "topics": [
        "psychology",
        "mental-health",
        "therapy"
      ],
      "editorialRank": 13,
      "metadata": {
        "title": "Dr. Julie",
        "coverImageUrl": null,
        "itemCount": 0,
        "audioCount": 0,
        "previewItems": []
      }
    },
    {
      "slug": "kati-morton",
      "catalogVersion": 1,
      "locale": "en",
      "title": "Kati Morton",
      "summary": "Therapy education and mental-health communication skills.",
      "type": "youtube_videos",
      "value": "https://www.youtube.com/@Katimorton",
      "sourceTypes": [
        "youtube_videos"
      ],
      "topics": [
        "therapy",
        "mental-health",
        "psychology"
      ],
      "editorialRank": 14,
      "metadata": {
        "title": "Kati Morton",
        "coverImageUrl": null,
        "itemCount": 0,
        "audioCount": 0,
        "previewItems": []
      }
    },
    {
      "slug": "graham-stephan",
      "catalogVersion": 1,
      "locale": "en",
      "title": "Graham Stephan",
      "summary": "Personal finance and investing commentary for broad audiences.",
      "type": "youtube_videos",
      "value": "https://www.youtube.com/@GrahamStephan",
      "sourceTypes": [
        "youtube_videos"
      ],
      "topics": [
        "investment",
        "personal-finance",
        "markets"
      ],
      "editorialRank": 15,
      "metadata": {
        "title": "Graham Stephan",
        "coverImageUrl": null,
        "itemCount": 0,
        "audioCount": 0,
        "previewItems": []
      }
    },
    {
      "slug": "ted",
      "catalogVersion": 1,
      "locale": "en",
      "title": "TED",
      "summary": "Cross-domain ideas on society, innovation and human potential.",
      "type": "youtube_videos",
      "value": "https://www.youtube.com/@TED",